{
  "$schema": "https://json-schema.org/draft/2020-12/schema",
  "type": "object",
  "properties": {
    "schemaVersion": {
      "type": "number",
      "const": 1
    },
    "issueId": {
      "type": "string",
      "pattern": "^issue_[0-9a-f]{8}-[0-9a-f]{4}-[1-8][0-9a-f]{3}-[89ab][0-9a-f]{3}-[0-9a-f]{12}$"
    },
    "commitSha": {
      "type": "string",
      "pattern": "^(?:[0-9a-f]{40}|[0-9a-f]{64})$"
    },
    "generatedAt": {
      "type": "string",
      "pattern": "^\\d{4}-\\d{2}-\\d{2}T\\d{2}:\\d{2}:\\d{2}\\.\\d{3}Z$"
    },
    "environment": {
      "type": "object",
      "properties": {
        "runner": {
          "type": "string",
          "minLength": 1,
          "maxLength": 10000
        },
        "operatingSystem": {
          "type": "string",
          "minLength": 1,
          "maxLength": 10000
        },
        "applicationVersion": {
          "type": "string",
          "minLength": 1,
          "maxLength": 10000
        },
        "viewport": {
          "type": "object",
          "properties": {
            "width": {
              "type": "integer",
              "exclusiveMinimum": 0,
              "maximum": 32768
            },
            "height": {
              "type": "integer",
              "exclusiveMinimum": 0,
              "maximum": 32768
            },
            "deviceScaleFactor": {
              "type": "number",
              "exclusiveMinimum": 0,
              "maximum": 8
            }
          },
          "required": ["width", "height", "deviceScaleFactor"],
          "additionalProperties": false
        }
      },
      "required": ["runner", "operatingSystem"],
      "additionalProperties": false
    },
    "artifacts": {
      "minItems": 1,
      "maxItems": 1000,
      "type": "array",
      "items": {
        "type": "object",
        "properties": {
          "path": {
            "type": "string",
            "minLength": 1,
            "maxLength": 512,
            "pattern": "^(?!\\/)(?!.*\\\\)(?!.*(?:^|\\/)\\.{1,2}(?:\\/|$))(?!.*\\/\\/).+$"
          },
          "mediaType": {
            "type": "string",
            "maxLength": 127,
            "pattern": "^(?:image|video)\\/[a-z0-9][a-z0-9.+-]*$"
          },
          "sha256": {
            "type": "string",
            "pattern": "^[0-9a-f]{64}$"
          },
          "title": {
            "type": "string",
            "minLength": 1,
            "maxLength": 255
          },
          "acceptanceCriteria": {
            "minItems": 1,
            "maxItems": 100,
            "type": "array",
            "items": {
              "type": "string",
              "minLength": 1,
              "maxLength": 10000
            }
          }
        },
        "required": ["path", "mediaType", "sha256", "title", "acceptanceCriteria"],
        "additionalProperties": false
      }
    }
  },
  "required": ["schemaVersion", "issueId", "commitSha", "generatedAt", "environment", "artifacts"],
  "additionalProperties": false
}
